### ISSUE TITLE
FORWARD don't work properly

### ISSUE THREAD

**Issue by barto95100** [netbirdio/netbird#1370]
**Describe the problem**
Host A test to ping other host (B), don't work but if the node netbird on LAN A ping the host (B) is ok

![CleanShot 2023-12-09 at 19 43 15](https://github.com/netbirdio/netbird/assets/17863254/7819ff17-de02-4e35-909e-c2c0dcbb77f6)

The route is configured on netbird dashboard

**Comment by Fantu** [comment]
Hi, I think it is useful to know more information, at least netbird version used as 0.24.4 have changes/fix relating forward https://github.com/netbirdio/netbird/pull/1305

**Comment by mlsmaycon** [comment]
Hello @barto95100 can you share the following details of your setup?

- is there are any custom configurations for the host A to access the IP of host B? any external routes, or custom firewall rules in any of the hosts?
- is NetBird A able to reach host B?

**Comment by barto95100** [comment]
My responsable : 
is there are any custom configurations for the host A to access the IP of host B? any external routes, or custom firewall rules in any of the hosts?

YEs the host A sens paquet to routeur (gateway of host A) and on gateway (mikrotik) I havé a route to indicate to Subnet B   -> NEtbird A, I start tcpdump on netbird 1 to view if paquet is received and it’s OK, and on netbird B nothing arrived from Netbird1

is NetBird A able to reach host B?

YEs netbird A access all host behind Netbird B

**Comment by mlsmaycon** [comment]
Hello @barto95100 ,

You need to add forward and maybe nat rules on netbird A:

```shell
sudo nft insert rule ip filter FORWARD ip saddr 10.150.10.49/32 accept
sudo nft insert rule ip filter FORWARD ip daddr 10.150.10.49/32  accept
sudo nft insert rule ip netbird netbird-rt-nat ip daddr 10.150.10.49/32  counter masquerade
```

**Comment by ydkn** [comment]
Hi there,

I also have an issue with the current version (`0.24.4`) that looks similar to the problem described here. If I downgrade to `0.24.3` everything works fine again.

To my env:
It is self-hosted and consists of 3 sites with a separate subnet behind Netbird (Netbird running on the gateway for each site). I have multiple routing rules so each site can reach systems in the subnets at the other sites (no masquerading).

It stopped work working after upgrading to `0.24.4` from `0.24.3`. Enabling masquerading in the routes also did not work. If I manually add the masquerading rule using `iptables` it starts working again.

**Comment by mlsmaycon** [comment]
Hello @ydkn, can you share more information about your network setup and firewall rules added manually? 

Is there any rules that you added before that is not being used in the new nftables chains?

**Comment by ydkn** [comment]
Hi @mlsmaycon,

As I'm trying to use the setup without masquerading there are not much rules in place - see attached diagram for reference.

The configured routes also look fine - e.g. on 172.28.0.2:
```
172.28.64.0/18 via 172.29.254.112 dev wt0 
172.28.128.0/18 via 172.29.254.112 dev wt0 
172.29.252.0/22 dev wt0 proto kernel scope link src 172.29.254.112 
```

![Drawing 2023-12-12 11 12 20 excalidraw](https://github.com/netbirdio/netbird/assets/231497/d5cdd00d-b107-4a76-ac14-abdfd9792159)

**Comment by mlsmaycon** [comment]
@ydkn thanks for sharing. Can you confirm that the gateways are also unable to connect to the IPs behind the other gateways?

**Comment by ydkn** [comment]
@mlsmaycon I dug a little deeper and figured this out:

I had Netbird running not only on the gateways but also on most of the servers within the subnets of the site. Routing is setup to always use the local gateway for the other sites and also the routing rules in netbird only use the instance running on the gateway nodes to avoid routing conflicts. (That allowed my to have a fallback in case there is an issue with gateway gateway itself - internet access would still work)

The routes in Netbird are only assigned to the instances running on the gateway servers (there is also no route configured on the other systems running Netbird within the local subnet - so this seems to work)

If I shutdown Netbird on the other systems (and the local routing is used). I can reach systems behind the gateway from behind another gateways but not the gateway IP itself (local IP).
Example: I can ping `172.28.0.3` from `172.28.64.0/18` but **NOT** `172.28.0.2`

**Comment by ydkn** [comment]
Correction on my last post:
Even with the Netbird agent running on other servers within the local subnet I can reach them from another site. I only have problems reaching things on the gateway server that do not use the Wiregurad/Netbird IP.

**Comment by Horus-K** [comment]
After setting up iptables, the network can be connected ， but，I want to know why the https protocol does not take effect
![image](https://github.com/netbirdio/netbird/assets/48319268/2b261cef-8398-4701-847e-df99b171aef1)

**Comment by mlsmaycon** [comment]
> After setting up iptables, the network can be connected ， but，I want to know why the https protocol does not take effect ![image](https://private-user-images.githubusercontent.com/48319268/290106481-db390ddd-b6c5-4ae3-a641-a548387d6441.png?jwt=eyJhbGciOiJIUzI1NiIsInR5cCI6IkpXVCJ9.eyJpc3MiOiJnaXRodWIuY29tIiwiYXVkIjoicmF3LmdpdGh1YnVzZXJjb250ZW50LmNvbSIsImtleSI6ImtleTEiLCJleHAiOjE3MDI0NzYwNTcsIm5iZiI6MTcwMjQ3NTc1NywicGF0aCI6Ii80ODMxOTI2OC8yOTAxMDY0ODEtZGIzOTBkZGQtYjZjNS00YWUzLWE2NDEtYTU0ODM4N2Q2NDQxLnBuZz9YLUFtei1BbGdvcml0aG09QVdTNC1ITUFDLVNIQTI1NiZYLUFtei1DcmVkZW50aWFsPUFLSUFJV05KWUFYNENTVkVINTNBJTJGMjAyMzEyMTMlMkZ1cy1lYXN0LTElMkZzMyUyRmF3czRfcmVxdWVzdCZYLUFtei1EYXRlPTIwMjMxMjEzVDEzNTU1N1omWC1BbXotRXhwaXJlcz0zMDAmWC1BbXotU2lnbmF0dXJlPTg0OTUzMDg4ZGUzYTE1ZmEzMGFiY2NmN2VmZGFkODM0N2ZkODM3MzRkYWM5YjgyY2VlMGNhN2RiZjY5NmEwMDcmWC1BbXotU2lnbmVkSGVhZGVycz1ob3N0JmFjdG9yX2lkPTAma2V5X2lkPTAmcmVwb19pZD0wIn0.YwbLfbRIV0DSMYY9w1AQ_REa1qfeO2ST-GydmHDfm0A)

@Horus-K can you check configuring a larger MTU (e.g. 1420) for the nodes involved?

**Comment by mlsmaycon** [comment]
@ydkn , would you join our [Slack workspace](https://join.slack.com/t/netbirdio/shared_invite/zt-vrahf41g-ik1v7fV8du6t0RwxSrJ96A) to troubleshooting your issue?

**Comment by Horus-K** [comment]
> > After setting up iptables, the network can be connected ， but，I want to know why the https protocol does not take effect ![image](https://private-user-images.githubusercontent.com/48319268/290106481-db390ddd-b6c5-4ae3-a641-a548387d6441.png?jwt=eyJhbGciOiJIUzI1NiIsInR5cCI6IkpXVCJ9.eyJpc3MiOiJnaXRodWIuY29tIiwiYXVkIjoicmF3LmdpdGh1YnVzZXJjb250ZW50LmNvbSIsImtleSI6ImtleTEiLCJleHAiOjE3MDI0NzYwNTcsIm5iZiI6MTcwMjQ3NTc1NywicGF0aCI6Ii80ODMxOTI2OC8yOTAxMDY0ODEtZGIzOTBkZGQtYjZjNS00YWUzLWE2NDEtYTU0ODM4N2Q2NDQxLnBuZz9YLUFtei1BbGdvcml0aG09QVdTNC1ITUFDLVNIQTI1NiZYLUFtei1DcmVkZW50aWFsPUFLSUFJV05KWUFYNENTVkVINTNBJTJGMjAyMzEyMTMlMkZ1cy1lYXN0LTElMkZzMyUyRmF3czRfcmVxdWVzdCZYLUFtei1EYXRlPTIwMjMxMjEzVDEzNTU1N1omWC1BbXotRXhwaXJlcz0zMDAmWC1BbXotU2lnbmF0dXJlPTg0OTUzMDg4ZGUzYTE1ZmEzMGFiY2NmN2VmZGFkODM0N2ZkODM3MzRkYWM5YjgyY2VlMGNhN2RiZjY5NmEwMDcmWC1BbXotU2lnbmVkSGVhZGVycz1ob3N0JmFjdG9yX2lkPTAma2V5X2lkPTAmcmVwb19pZD0wIn0.YwbLfbRIV0DSMYY9w1AQ_REa1qfeO2ST-GydmHDfm0A)
> 
> @Horus-K can you check configuring a larger MTU (e.g. 1420) for the nodes involved?
in nbA nbB set
`ifconfig wt0 mtu 1420`  doesn't work

**Comment by Horus-K** [comment]
ifconfig wt0 mtu 1420
in LAN 1
```
>curl https://xxxx.com/xx/awb
curl: (28) SSL/TLS connection timeout

**Comment by ydkn** [comment]
> @ydkn , would you join our [Slack workspace](https://join.slack.com/t/netbirdio/shared_invite/zt-vrahf41g-ik1v7fV8du6t0RwxSrJ96A) to troubleshooting your issue?

@mlsmaycon I join your slack workspace.

**Comment by mlsmaycon** [comment]
Great @ydkn , pls reach out to me there. You can find me by searching for. mlsmaycon

**Comment by mlsmaycon** [comment]
> ifconfig wt0 mtu 1420 in LAN 1
> 
> ```
> >curl https://xxxx.com/xx/awb
> curl: (28) SSL/TLS connection timeout
> ```

Can you run a tcpdump on the netbird server ss-pre-1? An example tcpdump command is:
```
sudo tcpdump -i any -n host 8.133.xxx.xxx and port 443
```

**Comment by Horus-K** [comment]
[19:24:19 root@centos7 ~] #tcpdump -i any -n host 101.132.xxx.xxx and port 443
tcpdump: verbose output suppressed, use -v or -vv for full protocol decode
listening on any, link-type LINUX_SLL (Linux cooked), capture size 262144 bytes
19:25:01.227870 IP 172.12.1.150.20514 > 101.132.xxx.xxx.https: Flags [S], seq 3788795406, win 64240, options [mss 1460,sackOK,TS val 2488341197 ecr 0,nop,wscale 7], length 0
19:25:01.245892 IP 101.132.xxx.xxx.https > 172.12.1.150.20514: Flags [S.], seq 171910593, ack 3788795407, win 64240, options [mss 1460], length 0
19:25:01.246003 IP 172.12.1.150.20514 > 101.132.xxx.xxx.https: Flags [.], ack 1, win 64240, length 0
19:25:01.339623 IP 172.12.1.150.20514 > 101.132.xxx.xxx.https: Flags [P.], seq 1:201, ack 1, win 64240, length 200
19:25:01.340172 IP 101.132.xxx.xxx.https > 172.12.1.150.20514: Flags [.], ack 201, win 64240, length 0


19:26:03.803212 IP 172.12.1.150.20514 > 101.132.xxx.xxx.https: Flags [.], ack 1, win 64240, length 0
19:26:14.016323 IP 101.132.xxx.xxx.https > 172.12.1.150.20510: Flags [R.], seq 1111898167, ack 417394575, win 64239, length 0


19:27:05.243304 IP 172.12.1.150.20514 > 101.132.xxx.xxx.https: Flags [.], ack 1, win 64240, length 0
19:27:05.243729 IP 101.132.xxx.xxx.https > 172.12.1.150.20514: Flags [.], ack 201, win 64240, length 0


19:27:58.158626 IP 172.12.1.150.20514 > 101.132.xxx.xxx.https: Flags [F.], seq 201, ack 1, win 64240, length 0
19:27:58.159179 IP 101.132.xxx.xxx.https > 172.12.1.150.20514: Flags [.], ack 202, win 64239, length 0
@mlsmaycon

**Comment by Horus-K** [comment]
```
in openwrt
19:51:36.819965 IP 10.255.250.88.38152 > 101.132.xxx.xxx.https: Flags [S], seq 628007990, win 65535, options [mss 1420,sackOK,TS val 2786663374 ecr 0,nop,wscale 9], length 0
19:51:36.820013 IP 192.168.14.86.38152 > 101.132.xxx.xxx.https: Flags [S], seq 628007990, win 65535, options [mss 1420,sackOK,TS val 2786663374 ecr 0,nop,wscale 9], length 0
19:51:36.830044 IP 101.132.xxx.xxx.https > 192.168.14.86.38152: Flags [S.], seq 119861510, ack 628007991, win 65535, options [mss 1460,sackOK,TS val 1003219675 ecr 2786663374,nop,wscale 9], length 0
19:51:36.830073 IP 101.132.xxx.xxx.https > 10.255.250.88.38152: Flags [S.], seq 119861510, ack 628007991, win 65535, options [mss 1460,sackOK,TS val 1003219675 ecr 2786663374,nop,wscale 9], length 0
19:51:36.844752 IP 10.255.250.88.38152 > 101.132.xxx.xxx.https: Flags [.], ack 1, win 128, options [nop,nop,TS val 2786663390 ecr 1003219675], length 0
19:51:36.844777 IP 192.168.14.86.38152 > 101.132.xxx.xxx.https: Flags [.], ack 1, win 128, options [nop,nop,TS val 2786663390 ecr 1003219675], length 0
19:51:36.844783 IP 10.255.250.88.38152 > 101.132.xxx.xxx.https: Flags [P.], seq 1:518, ack 1, win 128, options [nop,nop,TS val 2786663394 ecr 1003219675], length 517
19:51:36.844787 IP 192.168.14.86.38152 > 101.132.xxx.xxx.https: Flags [P.], seq 1:518, ack 1, win 128, options [nop,nop,TS val 2786663394 ecr 1003219675], length 517
19:51:36.854761 IP 101.132.xxx.xxx.https > 192.168.14.86.38152: Flags [.], ack 518, win 131, options [nop,nop,TS val 1003219700 ecr 2786663394], length 0
19:51:36.854783 IP 101.132.xxx.xxx.https > 10.255.250.88.38152: Flags [.], ack 518, win 131, options [nop,nop,TS val 1003219700 ecr 2786663394], length 0
19:51:36.858645 IP 101.132.xxx.xxx.https > 192.168.14.86.38152: Flags [P.], seq 1:2817, ack 518, win 131, options [nop,nop,TS val 1003219704 ecr 2786663394], length 2816
19:51:36.858660 IP 101.132.xxx.xxx.https > 10.255.250.88.38152: Flags [P.], seq 1:2817, ack 518, win 131, options [nop,nop,TS val 1003219704 ecr 2786663394], length 2816
19:51:36.858664 IP 101.132.xxx.xxx.https > 192.168.14.86.38152: Flags [P.], seq 2817:3354, ack 518, win 131, options [nop,nop,TS val 1003219704 ecr 2786663394], length 537
19:51:36.858668 IP 101.132.xxx.xxx.https > 10.255.250.88.38152: Flags [P.], seq 2817:3354, ack 518, win 131, options [nop,nop,TS val 1003219704 ecr 2786663394], length 537
19:51:36.864864 IP 10.255.250.88.38152 > 101.132.xxx.xxx.https: Flags [.], ack 1, win 131, options [nop,nop,TS val 2786663418 ecr 1003219700,nop,nop,sack 1 {2817:3354}], length 0
19:51:36.864885 IP 192.168.14.86.38152 > 101.132.xxx.xxx.https: Flags [.], ack 1, win 131, options [nop,nop,TS val 2786663418 ecr 1003219700,nop,nop,sack 1 {2817:3354}], length 0
19:51:36.867820 IP 10.255.250.88.38152 > 101.132.xxx.xxx.https: Flags [.], ack 1409, win 136, options [nop,nop,TS val 2786663421 ecr 1003219704,nop,nop,sack 1 {2817:3354}], length 0
19:51:36.867840 IP 192.168.14.86.38152 > 101.132.xxx.xxx.https: Flags [.], ack 1409, win 136, options [nop,nop,TS val 2786663421 ecr 1003219704,nop,nop,sack 1 {2817:3354}], length 0
19:51:36.867849 IP 10.255.250.88.38152 > 101.132.xxx.xxx.https: Flags [.], ack 3354, win 142, options [nop,nop,TS val 2786663422 ecr 1003219704], length 0
19:51:36.867858 IP 192.168.14.86.38152 > 101.132.xxx.xxx.https: Flags [.], ack 3354, win 142, options [nop,nop,TS val 2786663422 ecr 1003219704], length 0
19:51:36.908384 IP 10.255.250.88.38152 > 101.132.xxx.xxx.https: Flags [P.], seq 518:598, ack 3354, win 142, options [nop,nop,TS val 2786663462 ecr 1003219704], length 80
19:51:36.908413 IP 192.168.14.86.38152 > 101.132.xxx.xxx.https: Flags [P.], seq 518:598, ack 3354, win 142, options [nop,nop,TS val 2786663462 ecr 1003219704], length 80
19:51:36.908715 IP 10.255.250.88.38152 > 101.132.xxx.xxx.https: Flags [P.], seq 598:684, ack 3354, win 142, options [nop,nop,TS val 2786663463 ecr 1003219704], length 86
19:51:36.908735 IP 192.168.14.86.38152 > 101.132.xxx.xxx.https: Flags [P.], seq 598:684, ack 3354, win 142, options [nop,nop,TS val 2786663463 ecr 1003219704], length 86
19:51:36.909394 IP 10.255.250.88.38152 > 101.132.xxx.xxx.https: Flags [P.], seq 684:756, ack 3354, win 142, options [nop,nop,TS val 2786663463 ecr 1003219704], length 72
19:51:36.909408 IP 192.168.14.86.38152 > 101.132.xxx.xxx.https: Flags [P.], seq 684:756, ack 3354, win 142, options [nop,nop,TS val 2786663463 ecr 1003219704], length 72
19:51:36.918335 IP 101.132.xxx.xxx.https > 192.168.14.86.38152: Flags [.], ack 598, win 131, options [nop,nop,TS val 1003219764 ecr 2786663462], length 0
19:51:36.918362 IP 101.132.xxx.xxx.https > 10.255.250.88.38152: Flags [.], ack 598, win 131, options [nop,nop,TS val 1003219764 ecr 2786663462], length 0
19:51:36.918597 IP 101.132.xxx.xxx.https > 192.168.14.86.38152: Flags [P.], seq 3354:3433, ack 598, win 131, options [nop,nop,TS val 1003219764 ecr 2786663462], length 79
19:51:36.918614 IP 101.132.xxx.xxx.https > 10.255.250.88.38152: Flags [P.], seq 3354:3433, ack 598, win 131, options [nop,nop,TS val 1003219764 ecr 2786663462], length 79
19:51:36.918627 IP 101.132.xxx.xxx.https > 192.168.14.86.38152: Flags [.], ack 684, win 131, options [nop,nop,TS val 1003219764 ecr 2786663463], length 0
19:51:36.918635 IP 101.132.xxx.xxx.https > 10.255.250.88.38152: Flags [.], ack 684, win 131, options [nop,nop,TS val 1003219764 ecr 2786663463], length 0
19:51:36.918657 IP 101.132.xxx.xxx.https > 192.168.14.86.38152: Flags [P.], seq 3433:3512, ack 684, win 131, options [nop,nop,TS val 1003219764 ecr 2786663463], length 79
19:51:36.918662 IP 101.132.xxx.xxx.https > 10.255.250.88.38152: Flags [P.], seq 3433:3512, ack 684, win 131, options [nop,nop,TS val 1003219764 ecr 2786663463], length 79
19:51:36.918718 IP 101.132.xxx.xxx.https > 192.168.14.86.38152: Flags [P.], seq 3512:3583, ack 684, win 131, options [nop,nop,TS val 1003219764 ecr 2786663463], length 71
19:51:36.918726 IP 101.132.xxx.xxx.https > 10.255.250.88.38152: Flags [P.], seq 3512:3583, ack 684, win 131, options [nop,nop,TS val 1003219764 ecr 2786663463], length 71
19:51:36.919344 IP 101.132.xxx.xxx.https > 192.168.14.86.38152: Flags [.], ack 756, win 131, options [nop,nop,TS val 1003219765 ecr 2786663463], length 0
19:51:36.919354 IP 101.132.xxx.xxx.https > 10.255.250.88.38152: Flags [.], ack 756, win 131, options [nop,nop,TS val 1003219765 ecr 2786663463], length 0
19:51:36.925638 IP 101.132.xxx.xxx.https > 192.168.14.86.38152: Flags [P.], seq 3583:3849, ack 756, win 131, options [nop,nop,TS val 1003219771 ecr 2786663463], length 266
19:51:36.925657 IP 101.132.xxx.xxx.https > 10.255.250.88.38152: Flags [P.], seq 3583:3849, ack 756, win 131, options [nop,nop,TS val 1003219771 ecr 2786663463], length 266
19:51:36.925662 IP 101.132.xxx.xxx.https > 192.168.14.86.38152: Flags [P.], seq 3849:3880, ack 756, win 131, options [nop,nop,TS val 1003219771 ecr 2786663463], length 31
19:51:36.925667 IP 101.132.xxx.xxx.https > 10.255.250.88.38152: Flags [P.], seq 3849:3880, ack 756, win 131, options [nop,nop,TS val 1003219771 ecr 2786663463], length 31
19:51:36.926070 IP 10.255.250.88.38152 > 101.132.xxx.xxx.https: Flags [.], ack 3583, win 142, options [nop,nop,TS val 2786663480 ecr 1003219764], length 0
19:51:36.926088 IP 192.168.14.86.38152 > 101.132.xxx.xxx.https: Flags [.], ack 3583, win 142, options [nop,nop,TS val 2786663480 ecr 1003219764], length 0
19:51:36.926093 IP 10.255.250.88.38152 > 101.132.xxx.xxx.https: Flags [P.], seq 756:787, ack 3583, win 142, options [nop,nop,TS val 2786663480 ecr 1003219764], length 31
19:51:36.926097 IP 192.168.14.86.38152 > 101.132.xxx.xxx.https: Flags [P.], seq 756:787, ack 3583, win 142, options [nop,nop,TS val 2786663480 ecr 1003219764], length 31
19:51:36.932362 IP 10.255.250.88.38152 > 101.132.xxx.xxx.https: Flags [.], ack 3880, win 147, options [nop,nop,TS val 2786663486 ecr 1003219771], length 0
19:51:36.932382 IP 192.168.14.86.38152 > 101.132.xxx.xxx.https: Flags [.], ack 3880, win 147, options [nop,nop,TS val 2786663486 ecr 1003219771], length 0
19:51:36.936022 IP 101.132.xxx.xxx.https > 192.168.14.86.38152: Flags [.], ack 787, win 131, options [nop,nop,TS val 1003219781 ecr 2786663480], length 0
19:51:36.936050 IP 101.132.xxx.xxx.https > 10.255.250.88.38152: Flags [.], ack 787, win 131, options [nop,nop,TS val 1003219781 ecr 2786663480], length 0
19:51:36.938828 IP 10.255.250.88.38152 > 101.132.xxx.xxx.https: Flags [F.], seq 787, ack 3880, win 147, options [nop,nop,TS val 2786663492 ecr 1003219771], length 0
19:51:36.938848 IP 192.168.14.86.38152 > 101.132.xxx.xxx.https: Flags [F.], seq 787, ack 3880, win 147, options [nop,nop,TS val 2786663492 ecr 1003219771], length 0
19:51:36.948983 IP 101.132.xxx.xxx.https > 192.168.14.86.38152: Flags [F.], seq 3880, ack 788, win 131, options [nop,nop,TS val 1003219794 ecr 2786663492], length 0
19:51:36.949015 IP 101.132.xxx.xxx.https > 10.255.250.88.38152: Flags [F.], seq 3880, ack 788, win 131, options [nop,nop,TS val 1003219794 ecr 2786663492], length 0
19:51:36.954874 IP 10.255.250.88.38152 > 101.132.xxx.xxx.https: Flags [.], ack 3881, win 147, options [nop,nop,TS val 2786663509 ecr 1003219794], length 0
19:51:36.954902 IP 192.168.14.86.38152 > 101.132.xxx.xxx.https: Flags [.], ack 3881, win 147, options [nop,nop,TS val 2786663509 ecr 1003219794], length 0

**Comment by barto95100** [comment]
> Hello @barto95100 ,
> 
> You need to add forward and maybe nat rules on netbird A:
> 
> ```shell
> sudo nft insert rule ip filter FORWARD ip saddr 10.150.10.49/32 accept
> sudo nft insert rule ip filter FORWARD ip daddr 10.150.10.49/32  accept
> sudo nft insert rule ip netbird netbird-rt-nat ip daddr 10.150.10.49/32  counter masquerade
> ```
Don’t work for me … :( 

Nos other problem, on mac os x netbird connect, after X hours not access behind netbird B it’s necessary to disconnect/Re-connect to work again…. :(

**Comment by matiasblancor** [comment]
It's resolved in version 0.25.1

**Comment by Horus-K** [comment]
@jiangslee Have you tried https service to work?

**Comment by Horus-K** [comment]
@jiangslee I upgraded to the latest 25.4, and https can also be accessed. This problem has always existed in the previous 23.x version, and this version is very stable in my current testing.

**Comment by Horus-K** [comment]
@jiangslee yes

**Comment by xromansx** [comment]
I think it broke again in 0.26.3 running on x86 OpenWRT snapshot.

**Comment by nazarewk** [comment]
Hello @barto95100,
                    
                    We're currently reviewing our open issues and would like to verify if this problem still exists in the [latest NetBird version](https://github.com/netbirdio/netbird/releases).
                    
                    Could you please confirm if the issue is still there?
                    
                    We may close this issue temporarily if we don't hear back from you within **2 weeks**, but feel free to reopen it with updated information.
                    
                    Thanks for your contribution to improving the project!

**Comment by mlsmaycon** [comment]
closing issue due to no recent feedback. Feel free to open a new one if the issue persist or reopen if this was a feature request.

**Comment by barto95100** [comment]
It's Ok with the last version 


Excuse delay response :) @mlsmaycon & @nazarewk

**Comment by mlsmaycon** [comment]
No worries and Thanks for confirming @barto95100
