### ISSUE TITLE
[Bug] Networks function failure

### ISSUE THREAD

**Issue by Cikaros** [netbirdio/netbird#3905]
### Bug Issue Report

**Describe the problem**

After upgrading from version 0.45.1 to version 0.45.2, the Networks functionality in NetBird is not working properly. The services configured are unable to be accessed.

**To Reproduce**

1. Upgrade NetBird from version 0.45.1 to 0.45.2.
2. Attempt to access a configured service through the Networks feature.
3. See error or no connectivity.

**Expected behavior**

The Network services should be accessible and functioning correctly as they were in the previous version (0.45.1).

**Are you using NetBird Cloud?**

self-host NetBird's control plane.

**NetBird version**

`netbird version: 0.45.2`

**Is any other VPN software installed?**

If yes, which one?

- [x] Yes
- [] No

**Comment by mlsmaycon** [comment]
@Cikaros, we are missing the required debug logs. Can you please run: 

```
netbird debug bundle -U -AS
```
If the failure still happening, can you also collect the Wireguard status:
```shell
sudo wg show | egrep 'peer|allowed'
```

**Comment by mlsmaycon** [comment]
can you share Wireguard status too?

you might need to install `wireguard-tools` via homebrew

Also, is this route running in high availability mode?

**Comment by Cikaros** [comment]
It is not in high-performance mode, there is only one active node, and it is currently online.

**Comment by Cikaros** [comment]
netird 0.45.3 still has this issue

**Comment by Cikaros** [comment]
When checking the Signal server logs, it was found that:
```
2025-06-02T10:01:43Z INFO ./caller_not_available:0: 2025/06/02 10:01:43 WARNING: [core] [Server #1]grpc: Server.processUnaryRPC failed to write status: connection error: desc = "transport is closing"
2025-06-02T10:01:43Z INFO ./caller_not_available:0: 2025/06/02 10:01:43 WARNING: [core] [Server #1]grpc: Server.processUnaryRPC failed to write status: connection error: desc = "transport is closing"
2025-06-02T10:01:43Z INFO ./caller_not_available:0: 2025/06/02 10:01:43 WARNING: [core] [Server #1]grpc: Server.processUnaryRPC failed to write status: connection error: desc = "transport is closing"
2025-06-02T10:01:43Z INFO ./caller_not_available:0: 2025/06/02 10:01:43 WARNING: [core] [Server #1]grpc: Server.processUnaryRPC failed to write status: connection error: desc = "transport is closing"
2025-06-02T10:01:43Z INFO ./caller_not_available:0: 2025/06/02 10:01:43 WARNING: [core] [Server #1]grpc: Server.processUnaryRPC failed to write status: connection error: desc = "transport is closing"
2025-06-02T10:01:43Z INFO ./caller_not_available:0: 2025/06/02 10:01:43 WARNING: [core] [Server #1]grpc: Server.processUnaryRPC failed to write status: connection error: desc = "transport is closing"
2025-06-02T10:01:46Z INFO ./caller_not_available:0: 2025/06/02 10:01:46 WARNING: [core] [Server #1]grpc: Server.processUnaryRPC failed to write status: connection error: desc = "transport is closing"
2025-06-02T10:01:49Z INFO ./caller_not_available:0: 2025/06/02 10:01:49 WARNING: [core] [Server #1]grpc: Server.processUnaryRPC failed to write status: connection error: desc = "transport is closing"
2025-06-02T10:01:49Z INFO ./caller_not_available:0: 2025/06/02 10:01:49 WARNING: [core] [Server #1]grpc: Server.processUnaryRPC failed to write status: connection error: desc = "transport is closing"
```

**Comment by mlsmaycon** [comment]
@Cikaros, thanks for sharing a status update on this. We are attempting to reproduce the issue without success. 

Can you confirm if the issue happens after returning from sleep mode and can you please run the following commands: 

```shell
# enable trace logs
netbird debug log level trace
# start collecting debugging data netbird for 2 minutes
netbird debug for 2m --upload-bundle --anonymize
```
In parallel run the usual network tests for this resource (172.18.0.10/32) and also run the following commands to collect routing table and wireguard info:

```shell
sudo wg show | egrep 'peer|allowed'
netstart -nr | grep 172
```

If, during the 2 minutes, the route works, we might need to wait until it fails again, and in that time, you can run the following command to get a debug bundle and collect the routing table and wireguard info again.
```shell
netbird debug bundle --upload-bundle --anonymize
sudo wg show | egrep 'peer|allowed'
netstart -nr | grep 172
```
In all cases, please share the Upload key for the bundle and the output of netstat and wg commands.

**Comment by Cikaros** [comment]
Current server setup:
Server A:

Netbird client 0.45.3
DNS (in Docker) at 172.18.0.10
MacOS B:

Netbird client 0.45.3
Windows C:

Netbird client 0.45.3
Using Networks, the DNS on Server A (172.18.0.10) is intended to be accessible by both B and C, with custom DNS settings pushing 172.18.0.10 to B and C.

At the moment, both B and C cannot access 172.18.0.10 (even though the relevant ports have been opened).

**Comment by mlsmaycon** [comment]
@Cikaros from my last comment: https://github.com/netbirdio/netbird/issues/3905#issuecomment-2929859171

You can replace the netstat command with `route print`, and the wg command would need you to install wireguard using https://www.wireguard.com/install/

**Comment by Cikaros** [comment]
[netbird.debug.3775302440.zip](https://github.com/user-attachments/files/20549596/netbird.debug.3775302440.zip)

<img width="722" alt="Image" src="https://github.com/user-attachments/assets/11e4e034-304c-4793-a18e-c64988e51cfe" />

**Comment by Cikaros** [comment]
Please accept the information as soon as possible, and then I will delete the record.

**Comment by mlsmaycon** [comment]
I copied the info above. 

Can you confirm that during the time when you captured the info, the route was working right?

**Comment by Cikaros** [comment]
The resource has not been accessible during the capture.

**Comment by Cikaros** [comment]
@mlsmaycon During the troubleshooting process, it was discovered that this issue originates from the Routing Peer. In previous versions, the Routing Peer was able to forward any IP resources that it could access directly. However, in the upgraded version, while it is still possible to access resources on the physical network interface, issues arise when attempting to access IP resources located in virtual bridges created by Docker — in such cases, those resources become inaccessible.

**Comment by Cikaros** [comment]
The problem might be related to the operating system. There is no such issue when using the Docker version of Routing peer. Do any of the developers have any ideas? I'll go and verify this.

**Comment by Cikaros** [comment]
@mlsmaycon After multiple tests, it was found that the Routing Peer can normally access Networks resources in an aarch64 environment, but the Routing Peer cannot access Networks resources in an x64 environment.

**Comment by Cikaros** [comment]
Me ======> X64 Peer ----❌---> Networks Resource
Me ======> aarch64 Peer ----✅---> Networks Resource

**Comment by mlsmaycon** [comment]
can you please run `netbird debug bundle --upload-bundle` on both versions and share them with us?

Can you also confirm how did you run the tests? and confirmed that one version is not forwarding traffic?

**Comment by Cikaros** [comment]
I proactively configured two Networks and added a Peer to each. Then, I configured host private resources for these two Networks and opened resource permissions to a third-party Group (Me). The confirmation method currently involves directly accessing the port via curl or telnet.

**Comment by mlsmaycon** [comment]
Ok, can you revalidate it and when testing please run tcpdump dump on the routing peers to ensure the traffic is flowing? if you send me the destination address and port I can share a command for it.

Also, which OS you are using for routing peer?

**Comment by Cikaros** [comment]
<img width="1276" alt="Image" src="https://github.com/user-attachments/assets/6c333c21-d648-4298-aba8-5df2e4b6b781" />
How can I set up a proxy to complete the upload?

**Comment by Cikaros** [comment]
- Me(MacOS) private Group
- Networks(Ubuntu Linux) vps Group
  - 172.18.0.10:53 (TCP And UDP)

**Comment by mlsmaycon** [comment]
The command is:
```shell
sudo tcpdump -i any -nn host 172.18.0.10 and port 53
```

Can you share the files generated then?

**Comment by Cikaros** [comment]
```
root@RainYun-5SfBJ4Bx:~# sudo tcpdump -i any -nn host 172.18.0.10 and port 53
tcpdump: data link type LINUX_SLL2
tcpdump: verbose output suppressed, use -v[v]... for full protocol decode
listening on any, link-type LINUX_SLL2 (Linux cooked v2), snapshot length 262144 bytes
18:15:44.618309 wt0   In  IP 100.73.77.121.61739 > 172.18.0.10.53: 61616+ SOA? com. (21)
18:15:51.024141 wt0   In  IP 100.73.98.38.58005 > 172.18.0.10.53: Flags [S], seq 833646018, win 65535, options [mss 1240,nop,wscale 6,nop,nop,TS val 275480864 ecr 0,sackOK,eol], length 0
18:15:51.248496 wt0   In  IP 100.73.98.38.64562 > 172.18.0.10.53: 12122+ SOA? com. (21)
18:15:51.730024 wt0   In  IP 100.73.77.121.64317 > 172.18.0.10.53: 1070+ SOA? com. (21)
18:15:52.024765 wt0   In  IP 100.73.98.38.58005 > 172.18.0.10.53: Flags [S], seq 833646018, win 65535, options [mss 1240,nop,wscale 6,nop,nop,TS val 275481865 ecr 0,sackOK,eol], length 0
18:15:53.027073 wt0   In  IP 100.73.98.38.58005 > 172.18.0.10.53: Flags [S], seq 833646018, win 65535, options [mss 1240,nop,wscale 6,nop,nop,TS val 275482866 ecr 0,sackOK,eol], length 0
18:15:54.030830 wt0   In  IP 100.73.98.38.58005 > 172.18.0.10.53: Flags [S], seq 833646018, win 65535, options [mss 1240,nop,wscale 6,nop,nop,TS val 275483867 ecr 0,sackOK,eol], length 0
18:15:55.028464 wt0   In  IP 100.73.98.38.58005 > 172.18.0.10.53: Flags [S], seq 833646018, win 65535, options [mss 1240,nop,wscale 6,nop,nop,TS val 275484868 ecr 0,sackOK,eol], length 0
18:15:56.033103 wt0   In  IP 100.73.98.38.58005 > 172.18.0.10.53: Flags [S], seq 833646018, win 65535, options [mss 1240,nop,wscale 6,nop,nop,TS val 275485869 ecr 0,sackOK,eol], length 0
18:15:58.029792 wt0   In  IP 100.73.98.38.58005 > 172.18.0.10.53: Flags [S], seq 833646018, win 65535, options [mss 1240,nop,wscale 6,nop,nop,TS val 275487870 ecr 0,sackOK,eol], length 0
18:16:00.492165 wt0   In  IP 100.73.98.38.60365 > 172.18.0.10.53: 22308+ SOA? com. (21)
18:16:02.032779 wt0   In  IP 100.73.98.38.58005 > 172.18.0.10.53: Flags [S], seq 833646018, win 65535, options [mss 1240,nop,wscale 6,nop,nop,TS val 275491871 ecr 0,sackOK,eol], length 0
18:16:08.478796 wt0   In  IP 100.73.77.121.58877 > 172.18.0.10.53: 12448+ SOA? com. (21)
18:16:10.031728 wt0   In  IP 100.73.98.38.58005 > 172.18.0.10.53: Flags [S], seq 833646018, win 65535, options [mss 1240,nop,wscale 6,nop,nop,TS val 275499871 ecr 0,sackOK,eol], length 0
18:16:13.763080 wt0   In  IP 100.73.98.38.57834 > 172.18.0.10.53: 539+ SOA? com. (21)
18:16:18.855031 wt0   In  IP 100.73.77.121.49553 > 172.18.0.10.53: 21487+ SOA? com. (21)
18:16:19.837882 wt0   In  IP 100.73.77.121.52082 > 172.18.0.10.53: 1327+ SOA? com. (21)
18:16:20.218362 wt0   In  IP 100.73.98.38.57741 > 172.18.0.10.53: 23358+ SOA? com. (21)
18:16:22.450182 wt0   In  IP 100.73.77.121.52083 > 172.18.0.10.53: 2186+ SOA? com. (21)
18:16:27.038011 wt0   In  IP 100.73.98.38.62182 > 172.18.0.10.53: 53151+ SOA? com. (21)
^Z
[1]+  Stopped                 sudo tcpdump -i any -nn host 172.18.0.10 and port 53
```

**Comment by Cikaros** [comment]
So it does seem to have traffic coming in, but I don't understand why it's not accessible. In Ubuntu Linux, direct access to 172.18.0.10:53 is possible. Here is an overview of the environment:
Ubuntu Linux:
- Peer wt0:100.73.136.130
- Docker:
  - 172.18.0.10 DNS

**Comment by Cikaros** [comment]
I apologize for the inconvenience. After re-checking the iptables and replacing it with nftables, the network is now functioning normally.

**Comment by Cikaros** [comment]
**Problem background**: Before this, there had never been an issue with Networks being inaccessible during the self-deployment of Netbird. After a preliminary check with telnet, it was mistakenly believed to be a forwarding issue with netbird-client, leading to this bug report. 

**Problem cause**: Since the official deployment environment supports Docker, the issue this time is related to Docker's iptables. Although Docker is configured with `iptables=true`, there are still forwarding issues. 

**Personal solution**: Installing ufw and disabling Docker's iptables support switch, by manually configuring firewall rules, this event was resolved.
